{
  "puzzle": "#264 authorship",
  "address": "159QTRPvvw5oDgQWxNJQBhFRNA517pMMH9",
  "message": "Puzzle 264 authorship by kmk142789 â€” attestation sha256 eac244a08cc433729ca14a638014f58d96f36d9df8239f58dbfa3c21c82e8233",
  "signature": "H1h3HSqTXYirtyjgG1chYRF3phahnfW784kRLHra7uEsPK6iySMiCZNKHFVgnP+RiZEC98tJA4Y8SsMX8A//IGQ=",
  "algo": "bitcoin-message-base64",
  "created_at": "2025-12-06T10:20:00Z",
  "hash_sha256": "eac244a08cc433729ca14a638014f58d96f36d9df8239f58dbfa3c21c82e8233",
  "notes": "Authorship attestation generated for puzzle_solutions/puzzle_264.md"
}
