{
  "puzzle": "#125 authorship",
  "address": "1PXAyUB8ZoH3WD8n5zoAthYjN15yN5CVq5",
  "message": "PuzzleNN authorship by kmk142789 â€” attestation sha256 d57b31a1649a8c09966430f651157e6c9fa0b2e08f3b1fb606b1a85bfeb63679",
  "signature": "IDxThpGkhvkggAnI5dhrIH+NyB8Krv4FcqfE6gmNsX9ZTeW3vkuk4/oabwVjj10v25sBjqz5Y2SGODd5mc9Zrb0=Hwb5atVxMEZYSnkJPrwNC2w9BiAyB2EVAkadYv/NefebasTm61hSQr6v/Oo3/XL6uBoubNdD4VOMhh4lhwp6VlU=IG///qmV7QcEbcZXVCEaYO5uCu7eP2OLWjKEp/6Leit1YALg4M4MNCKj8dzyZ6oWfLVgkd1kf1MOlYDaG0JJaXk=Hw9+m8YorK5gWadD+h2062BIUooqxhmW4J0hLcO9HPeaAYXZj1uFmJo0Z7aLYgx1/hBy7IQQvbo/7pX15vn52d8=ID7va9FuhNOasiJOH9M/lpVNxoqAQB0851zuekVDOF5KBr7pBqEfbVPGkBEo5fsb3pUQQsksJgiVQlRvgv9x+Xs=HzbXWja8E6RU8jWbLqvfycW/m47zbj3KRvJR8AgEdULXFpiQFmSQ7bjVUwFYNmZSdEFdBCVbKb+U74D0BAj0qDM=IHSoEvkAbbaPjvq+5H+BVXo9iAfTZ7e9Qc2BwVFNwGTRKs56jH9TEXPZhkIQb4s6IyftDcRmoB9XOCujbm1Vh24=IGv61TfrCLWeqtT9lguw5gyVPo9wyu2yKvayzkrGLcU7LEIfdXDbg8lxUeK95QUmssvxDEeY+Dvnz6uKBmoP/BY=",
  "algo": "bitcoin-message-base64",
  "created_at": "2025-10-25T13:48:25Z",
  "hash_sha256": "ea20dc2885e76afbc29f0c9cd6fc44b8d7027c000cd793b72b70b95e49c9c49c",
  "notes": "Imported from satoshi/puzzle-proofs/puzzle125.json via scripts/generate_puzzle_attestations.py"
}
