{
  "puzzle": "#313 authorship",
  "address": "1AJbsFZ64EpEfS5UAjAfcUG8pH8Jn3rn1F",
  "message": "Puzzle 313 authorship by kmk142789 â€” attestation sha256 cf8316335ad3f48b261ee20e25a1c5d7fb23ac14fb3ee9de4e3ee07f628ac065",
  "signature": "NvtPBxsHR5MNuaDRomrAhjsvGw5HKu85x5u+YoWeDGRQjLRHOHRGr0mcqtBOmXY4PItRPC5cDXHZ6LxtPkSDqQ==",
  "algo": "bitcoin-message-base64",
  "created_at": "2025-12-06T14:35:00Z",
  "hash_sha256": "cf8316335ad3f48b261ee20e25a1c5d7fb23ac14fb3ee9de4e3ee07f628ac065",
  "notes": "Authorship attestation generated for puzzle_solutions/puzzle_313.md"
}
