{
  "puzzle": "#291 authorship",
  "address": "1Efzgc9hk5PXtxr9oJ7RBTu15Znfzbz8Wn",
  "message": "Puzzle 291 authorship by kmk142789 â€” attestation sha256 40c8188af6990adb74a5a1667283fdd9d86c5b141a106b8dfc6b73241af217aa",
  "signature": "eTBEbMk0kYV96zUeabspdAFr/HToFOPeV/q8xna0mKCrKna7fqo1cijIdGPmwPe4B7jI4iusx4QE2tNHAbD7EQ==",
  "algo": "bitcoin-message-base64",
  "created_at": "2025-12-06T12:45:00Z",
  "hash_sha256": "40c8188af6990adb74a5a1667283fdd9d86c5b141a106b8dfc6b73241af217aa",
  "notes": "Authorship attestation generated for puzzle_solutions/puzzle_291.md"
}
