{
  "puzzle": "#261 authorship",
  "address": "12wquDReaVqSLGQkyf9NCoeXaTjqE98vr8",
  "message": "Puzzle 261 authorship by kmk142789 â€” attestation sha256 51e081163f05b2e1460712e0716d7ebef3a3be38537657b01df80e7f32478d71",
  "signature": "H2COsTNf160FVSlum17FnB9YZX7Ya5qmFPdyqddt7Kbqasi7IZ0SkNNhnnothS3bs7ClcZJbeDhO6+t7O0uZDJI=",
  "algo": "bitcoin-message-base64",
  "created_at": "2025-12-06T10:05:00Z",
  "hash_sha256": "51e081163f05b2e1460712e0716d7ebef3a3be38537657b01df80e7f32478d71",
  "notes": "Authorship attestation mirrored into satoshi/puzzle-proofs/puzzle261.json"
}
