{
  "puzzle": "#263 authorship",
  "address": "1G8qJN6Tev2H5pHsCJ9twXQ9vXUXDguHtM",
  "message": "Puzzle 263 authorship by kmk142789 â€” attestation sha256 728e69aba1cfe291e42ede703aad151639314c553b3641e737f3799b9697241b",
  "signature": "IF2iX1VT87jKZ7bxGxqcDB3BJ0NuZVbk8d572zSHGWjFPtXCBLtg2Q5c+SvdQnnTrcsZczpnRepjaTb6to42X4Q=",
  "algo": "bitcoin-message-base64",
  "created_at": "2025-12-06T10:15:00Z",
  "hash_sha256": "728e69aba1cfe291e42ede703aad151639314c553b3641e737f3799b9697241b",
  "notes": "Authorship attestation mirrored into satoshi/puzzle-proofs/puzzle263.json"
}
