{
  "puzzle": "#298 authorship",
  "address": "1BxzPq7v8Rjs1CfTQLo2yZ6W8fMmTgYVph",
  "message": "Puzzle 298 authorship by kmk142789 â€” attestation sha256 2a6f8a1a66a3ff3a822994f10209a44549aaf1b66a7d2d85b2133c4609acbae8",
  "signature": "rXlo4b5P6bl5u2IO4IOEPpW+DXrxaFWI8Vx/dcaciVBSwFCgEDFkmW6+jqZdWs7D545mPt4d1cFYf2Qvw1GVXw==",
  "algo": "bitcoin-message-base64",
  "created_at": "2025-12-06T13:20:00Z",
  "hash_sha256": "2a6f8a1a66a3ff3a822994f10209a44549aaf1b66a7d2d85b2133c4609acbae8",
  "notes": "Authorship attestation generated for puzzle_solutions/puzzle_298.md"
}
