{
  "puzzle": "#296 authorship",
  "address": "1M9nLtE4pC7s2AXDyVQjg5twvZ4rDb6oFJ",
  "message": "Puzzle 296 authorship by kmk142789 â€” attestation sha256 f859095e9768566c3597d54016f79ebe8868f8ae4f55a435168f1e8e4b8eb5a2",
  "signature": "PsoJHVZaSVawuPfyBqzFVidclPVuYQ+21WIzmwLkyDuL7ZpwnI85xxBn2qVjBLP8etcxewHhVJtTRXCVlhVjqg==",
  "algo": "bitcoin-message-base64",
  "created_at": "2025-12-06T13:10:00Z",
  "hash_sha256": "f859095e9768566c3597d54016f79ebe8868f8ae4f55a435168f1e8e4b8eb5a2",
  "notes": "Authorship attestation generated for puzzle_solutions/puzzle_296.md"
}
